{"provider":"acme-pay","from_version":"1.0.0","to_version":"2.0.0","spec_url":"http://localhost:8800/spec.yaml","generated_at":"2026-10-17T15:00:00Z","changes":[
{"id":"chg_001","kind":"breaking","method":"POST","path":"/v1/charges","location":"request_param","name":"amount_cents","summary":"Request param amount_cents renamed to amount_minor.","before":"amount_cents","after":"amount_minor","migration_hint":"Rename the amount_cents request field to amount_minor; the value is unchanged."},
{"id":"chg_002","kind":"breaking","method":"DELETE","path":"/v1/legacy/tokens/{token}","location":"endpoint","summary":"Endpoint removed, replaced by DELETE /v1/tokens/{token}.","migration_hint":"Call DELETE /v1/tokens/{token} instead of DELETE /v1/legacy/tokens/{token}."},
{"id":"chg_003","kind":"added","method":"POST","path":"/v1/charges","location":"enum_value","name":"requires_review","summary":"New charge status value requires_review.","migration_hint":"Handle the requires_review charge status; treat it as not yet captured."},
{"id":"chg_004","kind":"added","method":"DELETE","path":"/v1/tokens/{token}","location":"endpoint","summary":"New endpoint DELETE /v1/tokens/{token}.","migration_hint":"Use this endpoint to delete tokens; it replaces the legacy path."}]}
